Título,Precio,Categoría,Fecha de lanzamiento,Descripción
Wildlife Adventures Collection – 3 in 1,"69,99 €*","• Aventura, Plataformas",20-05-2024,Este paquete contiene: - Horse Tales: Emerald Valley Ranch - Dolphin Spirit - Ocean Mission - Marsupilami Hoobadventure
The Magic and Murder Bundle,"26,49 €18,54 €*","• Aventura, Otros, Puzle, Simulación",20-05-2024,"Investigate the case of the missing magician, or summon a demonic harem of murderous mistresses in Neon Doctrine’s Magic and Murder Bundle!"
Toon Toon Racing,"7,99 €*","• Arcade, Carreras, Fiesta, Simulación",19-05-2024,"Ignite your passion, feel the roar of the engines the vibrations of the road and race to victory!"
Undercat,"14,99 €*","• Acción, Aventura, Otros, Plataformas",18-05-2024,Undercat es un juego de plataformas 2D no restrictivo con modo cooperativo. ¡Ayuda a la Resistencia a derrocar la tiranía de los Gatos y liberar la ciudad animal!
Finger Suck,"0,99 €*","• Arcade, Aventura, Estrategia, Puzle",18-05-2024,Use your finger like a magnet!
Astroblaze DX,"4,99 €*","• Acción, Arcade, Música, Otros",18-05-2024,Combate la amenaza alienígena en Astroblaze
Eternal Light,"25,99 €*","• Aventura, Otros, Simulación",18-05-2024,"Sistemas Animados Novela Visual ""Eternal Light."""
Adrenaline Rush: Highway Extreme Traffic Racer,"7,99 €*","• Arcade, Carreras, Fiesta, Simulación",18-05-2024,Feel the Pulse of the Asphalt. The Ultimate Driving Challenge Awaits.
Truck Simulator City Delivery,"14,99 €1,99 €*","• Acción, Aventura, Carreras, Simulación",18-05-2024,¡Experimenta la emoción de la carretera—juega Truck Simulator City Delivery hoy!
Express Courier Pro: Urban Bike Delivery Simulator 2024!,"9,99 €*","• Carreras, Entrenamiento, Rol (RPG), Simulación",17-05-2024,"Embrace the challenge, fuel your ambition, and become the ultimate master of the rush as you dominate the streets!"
Morbid: The Lords of Ire,"29,99 €*","• Acción, Aventura, Rol (RPG)",17-05-2024,Alza tu espada contra los infames señores de Ira.
Sweetest Monster,"5,99 €*","• Aventura, Otros",17-05-2024,Un hombre es sus cuarenta se topa con una chica gato en el medio de la noche… Pero no todo es lo que parece.
Gearhead Karting Simulator - Mechanic & Racing,"11,99 €*","• Carreras, Entrenamiento, Rol (RPG), Simulación",17-05-2024,"Unleash your inner Gearhead and Racer: build, tune, and race your way to victory!"
FoxyRush,"4,99 €*","• Arcade, Plataformas, Puzle",17-05-2024,¡Una aventura emocionante que gustará a los fans de los zorros!
Return,"13,99 €9,79 €*","• Acción, Aventura, Disparos (Shooter), Plataformas",17-05-2024,"Return to your home planet after 200 years of space travel in this atmospheric, art-driven adventure. Shoot, slash, and roll your way through dangerous enemies and ancient bosses."
2D Indie Bundle,"75,00 €*","• Acción, Arcade, Aventura, Lucha",17-05-2024,2D Indie Game Bundle!
My Universe Discovery Collection 2,"79,99 €*","• Educativo, Estilo de vida, Simulación",17-05-2024,Descubre la gama de juegos My Universe con este paquete de 4 juegos que incluye : - My Universe - Puppies & Kittens - My Universe - Pet Clinic Cats & Dogs - My Universe - My Baby Dragon - My Universe - Green Adventure : Farmers Friends
Treasure Guardian: Collector Shift Defender's Saga,"12,99 €*","• Acción, Disparos (Shooter), Rol (RPG), Simulación",17-05-2024,"Defend, Collect, Prevail: Safeguard the Fortune, Secure Your Honor!"
Título no disponible,Precio no disponible,Categoría no disponible,Fecha no disponible,Descripción no disponible
,,,Fecha no disponible,
Título no disponible,Precio no disponible,Categoría no disponible,Fecha no disponible,Descripción no disponible
Overmorrow,"19,50 €*","• Aventura, Puzle",17-05-2024,"Overmorrow is a serene, nonviolent, exploration adventure game that deletes your save after 30 days."
My Little Pony: Misterio en los Altos de Céfiro,"39,99 €*","• Acción, Aventura",17-05-2024,¡Todos los ponis se han reunido para salvar el reino!
Spellcats: Auto Card Tactics,"9,99 €*","• Aventura, Estrategia, Tablero",17-05-2024,"¡Invoca michis elementales en este juego de cartas roguelike! Explora mazmorras misteriosas,haz combos de cartas y libera a tus compañeros felinos!"
Lorelei and the Laser Eyes,"22,99 €*","• Aventura, Puzle",16-05-2024,¿Recuerdas el laberinto?
Arcadia: Colony,"14,90 €*","• Acción, Aventura, Plataformas",16-05-2024,"Embárcate en una épica aventura en la Colonia y enfréntate a sus colosales Marionetas. Juega como tres valientes héroes con habilidades únicas, todo en estilo anime 2.5D."
Internet Generation,"14,99 €*","• Acción, Aventura, Lucha",16-05-2024,"En ese momento, Internet era definitivamente nuestro lugar... ¡Protejamos los recuerdos de esa época!"
Puzzle World: Neko Girls,"4,99 €*","• Estrategia, Fiesta, Puzle, Simulación",16-05-2024,¡Gira los elementos del rompecabezas y recopila todas las increíbles imágenes de estilo anime!
Trust No One,"3,99 €*","• Aventura, Otros, Puzle",16-05-2024,El juego sólo cuenta la mitad de la historia.
Word Guess,"2,00 €*","• Comunicación, Educativo, Puzle",16-05-2024,"Guess the 5-letter word in the 5 tries. If you don’t, then you don’t. You can try again."
Duck Creator,"0,99 €*","• Arcade, Educativo, Entrenamiento, Simulación",16-05-2024,Duck Creator Create your Duck!
Little Cat Doctor,"3,99 €*","• Arcade, Aventura, Educativo, Puzle",16-05-2024,Trabaja como veterinario en nuestro hospital de animales y sé el médico de adorables gatitos. Ayuda a nuestros amigos peludos a recuperar su salud y felicidad.
Plumber Pipe Out,"3,99 €*","• Arcade, Educativo, Entrenamiento, Puzle",16-05-2024,Plumber Pipe Out es un divertido y desafiante juego de rompecabezas en el que debes actuar como un plomero e intentar conectar todas las tuberías.
Life Sim Bundle,"89,99 €*","• Estilo de vida, Simulación",16-05-2024,"¡Conviértete en dueño de un restaurante con estrellas Michelin, entusiasta de la jardinería y director de una empresa ferroviaria!"
Ice Crush 10.000 BC,"1,99 €*",• Arcade,16-05-2024,¡Aplasta bloques de hielo!
Mutant Express,"10,99 €4,39 €*","• Acción, Aventura, Plataformas, Rol (RPG)",16-05-2024,"Juego de plataformas sobre la amistad. Entrega un paquete misterioso para salvar a tu amigo Kiki, a punto de convertirse en zorro."
Sling Puzzle: Golf Master,"14,79 €*","• Arcade, Deportes, Estrategia, Puzle",16-05-2024,Sling to flagstick through a maze of challenging puzzles! Use precision and wit on this fun rolling adventure!
Slide Puzzle World History,"2,49 €*","• Entrenamiento, Puzle, Uso práctico",16-05-2024,For Current Students and Those Relearning! Fun World History Puzzle Game
3 minutes Mystery 2,"7,99 €3,99 €*","• Aventura, Puzle, Simulación",16-05-2024,Unravel the New Mystery! You are the one to uncover the truth behind the crime scene by finding hidden evidence.
Please Fix The Road,"8,99 €*","• Estrategia, Puzle, Simulación, Tablero",16-05-2024,¡El juego de arreglar carreteras más bonito y relajante que existe!
Dungeon Arsenal,"6,99 €5,24 €*","• Estrategia, Puzle, Tablero",16-05-2024,DUNGEON ARSENAL es un trepidante juego de cartas roguelike. Recorre una serie de pisos generados aleatoriamente llenos de cartas que podrás revelar.
UNDEMON,"13,99 €*","• Acción, Plataformas",16-05-2024,¡Comienza una aventura para aliviar el resentimiento del fantasma 'Luna'!
Read Only Memories: NEURODIVER,"14,79 €*",• Aventura,16-05-2024,Los recuerdos se desvanecen... ¡No dejes que la verdad desaparezca también!
Puzzle World: Cute Cats,"4,99 €*","• Estrategia, Fiesta, Puzle, Simulación",16-05-2024,¡Gira los elementos del rompecabezas y recopila todas las increíbles imágenes de lindos gatos!
Monster Outbreak,"14,99 €1,94 €*","• Acción, Aventura",16-05-2024,"¡Consigue recursos, construye defensas y mejora tu arsenal para defender el reino de oleadas de peligrosos monstruos!"
Título no disponible,Precio no disponible,Categoría no disponible,Fecha no disponible,Descripción no disponible
,,,Fecha no disponible,
Título no disponible,Precio no disponible,Categoría no disponible,Fecha no disponible,Descripción no disponible
PO'ed: Definitive Edition,"19,99 €*","• Acción, Acción en primera persona (FPS), Aventura, Disparos (Shooter)",16-05-2024,¿Se han llevado la nave y a la tripulación? ¡SE LAS VERÁN CON UN CHEF CABREADO!
Musashi vs Cthulhu,"4,99 €*","• Acción, Arcade, Otros, Plataformas",16-05-2024,Ronin contra monstruos ¡Lucha sin fin!
Pool Party,"9,99 €*","• Arcade, Deportes, Fiesta",16-05-2024,¡Reúne a tus amigos y pelead con juegos grupales basados en la física en Pool Party!
Head Sports Football,"3,99 €*","• Acción, Arcade, Deportes, Plataformas",16-05-2024,"En Head Sports Football, controlas a un jugador con una cabeza enorme mientras compites contra oponentes experimentados en emocionantes partidos de fútbol."
Roman Empire Farming,"9,99 €*","• Acción, Estrategia",15-05-2024,Can you cultivate the lands of the ancient world and forge a prosperous legacy for generations to come?
Slayers X: Terminal Aftermath: Vengance of the Slayer,"16,49 €*","• Acción, Acción en primera persona (FPS), Disparos (Shooter), Plataformas",15-05-2024,.. bienvenido a.... LA CLOACA DE ACERO. La mayor base secreta de la galaxia. Somos X Slayers. Somos quienes luchamos contra el Psyko Sindikate.
Purple Explorer,"4,99 €*","• Acción, Arcade, Aventura, Plataformas",15-05-2024,"Welcome to the enchanting world of Purple Explorer, where cuteness and adventure collide!"
Awesome Pea 3,"4,99 €*","• Arcade, Plataformas",15-05-2024,"Juego de plataformas sobre las aventuras de Pea, a quien le encanta el oro"
"Braid, Anniversary Edition","19,99 €*","• Plataformas, Puzle",14-05-2024,Cambia el curso del tiempo para resolver puzles.
Biomutant,"39,99 €*","• Acción, Rol (RPG)",14-05-2024,"BIOMUTANT® es un RPG de kung-fu desarrollado en mundo abierto posapocalíptico que cuenta con un sistema de combate que combina artes marciales con ataques cuerpo a cuerpo, disparos y habilidades mutantes."
ATHENIAN RHAPSODY,"14,99 €*","• Acción, Aventura, Puzle, Rol (RPG)",14-05-2024,"ARE YOU READY FOR THE CRAZIEST GAME EVER? Forge your own zany story and explore the world of Athens in this one-of-a-kind, fast-paced, wacky comedy RPG!"
Lysfanga : The Time Shift Warrior,"24,99 €*","• Acción, Estrategia",14-05-2024,El destino de tu reino depende solo de ti. Retrocede en el tiempo para crear clones de tus representaciones pasadas y forma tu ejército.
Kingdom Heritage Bundle,"24,99 €*","• Estrategia, Rol (RPG)",14-05-2024,"Juega a través de distintas épocas con este excepcional paquete de la galardonada serie de estrategia Kingdom, que combina la inspiración medieval (Kingdom Two Crowns) con la inspiración ochentera (Kingdom Eighties) en un lote que trasciende el tiem"
Neptunia Game Maker R:Evolution,"49,99 €*","• Acción, Rol (RPG)",14-05-2024,¡Conviértete en el mejor mientras Older Nep brilla en este juego de rol único!
Mars Farming 2034,"9,99 €*","• Arcade, Simulación",13-05-2024,Can you green the Red Planet and carve out a new home for humanity?
High School Detective: Romance Visual Novel,"4,99 €*","• Aventura, Estilo de vida, Música, Otros",13-05-2024,"En una escuela secundaria de Nueva York, un grupo de amigos descubre un misterio que pone a prueba su amistad. Mientras investigan, surgen sentimientos entre ellos."
The Land Beneath Us,"14,99 €*","• Estrategia, Rol (RPG)",13-05-2024,Un roguelite de mazmorras por turnos basado en la mitología galesa.
Crab Digger TROPICAL ISLAND,"5,99 €0,99 €*","• Arcade, Aventura, Fiesta, Simulación",12-05-2024,"Break, Build, Compete: Unleash Your Inner Crab in a Tropical Adventure!"
Cosmic Robots,"4,99 €*","• Acción, Arcade, Disparos (Shooter), Simulación",12-05-2024,"Robots are invading – it's time to fight back! Build defences, lead armies, and defend your planet in this action-packed tower defence saga!"
Culinary Cooking Master Simulator,"12,99 €*","• Arcade, Aventura, Estilo de vida, Simulación",11-05-2024,"Become a Culinary Master! Cook, Experiment, and Conquer the Kitchen!"
Devil Girl,"25,99 €*","• Aventura, Otros, Simulación",11-05-2024,"Sistemas animados Novela visual ""Devil Girl."""
MergeZ,"0,99 €*","• Acción, Arcade, Disparos (Shooter), Estrategia",11-05-2024,Merge guns to stop the zombies
Hand in Hand,"11,99 €*","• Acción, Arcade, Disparos (Shooter), Estrategia",11-05-2024,"Sumérgete en el mundo étnico de dos héroes, resuelve acertijos y supera obstáculos juntos, explora el bosque de hadas y otros lugares, ayúdate unos a otros."
Roman City Tycoon,"9,99 €*","• Acción, Estrategia",11-05-2024,Are you ready to build your own roman city and protect?
Título no disponible,Precio no disponible,Categoría no disponible,Fecha no disponible,Descripción no disponible
,,,Fecha no disponible,
Título no disponible,Precio no disponible,Categoría no disponible,Fecha no disponible,Descripción no disponible
Hotel Hustle,"10,99 €1,99 €*","• Arcade, Estrategia, Simulación",10-05-2024,Adopte un enfoque muy práctico a la hora de gestionar un hotel bullicioso y asegúrese de que sus huéspedes se marchan con una sonrisa en la cara.
My Incubi Harem,"4,99 €*",• Aventura,10-05-2024,¡Rodéate de tus potenciales amantes y reclama el trono para tenerlos a todos a tus pies!
QUALIA ~The Path of Promise~,"18,99 €*",• Aventura,10-05-2024,"A story of pure love between a scientist and an android heroine and how they grow together, overcome fate and find happiness."
Kinduo 2 - Frostbite,"4,99 €*","• Plataformas, Puzle",10-05-2024,¡Los puzles de plataformas cooperativos de Kinduo han vuelto con el doble de diversión!
Spy Guy Memory,"3,99 €*","• Educativo, Otros, Puzle, Uso práctico",10-05-2024,Spy Guy Memory mejora la fórmula del clásico juego de memoria. Te da la posibilidad de aumentar el nivel de dificultad a tu propio ritmo y personalizar los retos.
Heads Will Roll: Reforged,"19,99 €*","• Aventura, Otros, Rol (RPG)",10-05-2024,Hardcore survival RPG with non-linear story that lets you play as a young medieval soldier who over the course of battles and adventures becomes the most formidable and respected knight.
ANIMAL WELL,"24,49 €*","• Aventura, Plataformas",09-05-2024,"Emerge de tu flor y lánzate a explorar el precioso e inquietante mundo de Animal Well, una maravilla pixelada con gráficos y audio muy detallados."
Gift,"24,50 €*","• Acción, Puzle",09-05-2024,Un anciano despierta y se encuentra a bordo de un crucero de lujo. Se encuentra con pasajeros de quienes siente nostalgia por diversos motivos al mismo tiempo que intenta escapar del barco que se hunde.
PAC-MAN Mega Tunnel Battle: Chomp Champs,"19,99 €*",• Arcade,09-05-2024,¡DEVORA Y COMPITE!
1000xRESIST,"19,99 €14,99 €*",• Aventura,09-05-2024,A society of clones is ripped apart by a 1000 year old secret
Chronicles of Magic: Divided Kingdoms,"14,99 €*","• Aventura, Puzle",09-05-2024,¡Haz que se reconcilien los Reinos gemelos!
Rainbow Cotton,"19,99 €*","• Acción, Aventura, Disparos (Shooter), Plataformas",09-05-2024,"Revive el clásico brujil, porque vuelve Rainbow Cotton."
CorpoNation: The Sorting Process,"14,99 €7,49 €*","• Aventura, Estrategia, Puzle, Simulación",09-05-2024,Le damos la bienvenida a la empresa. Su tarea consiste en clasificar las muestras genéticas de Ringo CorpoNation.
Dark Fantasy Epic Jigsaw Puzzle,"4,99 €*","• Puzle, Rol (RPG), Simulación, Tablero",09-05-2024,Assemble your way through the murky portraits of Dark Fantasy Epic!
Smack,"8,99 €*","• Arcade, Fiesta, Tablero",09-05-2024,"Step into the retro world of ""Smack,"" where you'll face off against a swarm of tiny cube monsters inside a simulated arcade cabinet. Your job? Slam them down before they take over!"
Alien Survivors: To Starship Resurrection,"16,99 €*","• Acción, Arcade, Disparos (Shooter), Estrategia",09-05-2024,Defeat the aliens and repair your spaceship to survive! Each stage equipped with a hot skill! A roguelike shooter that blows everything away!
Arcade Archives Tutankham,"6,99 €*","• Acción, Arcade",09-05-2024,Seek out the lost treasure of Tutankham!
Imagine Earth,"24,99 €*","• Estrategia, Puzle, Simulación",09-05-2024,Construye y abastece tus propias civilizaciones planetarias. Gestiona recursos y desarrolla infraestructuras para que prosperen.
LET'S THROOOW! Street Basketball Simulator,"4,99 €*","• Arcade, Deportes, Entrenamiento, Simulación",09-05-2024,¡Prepárate para una emocionante aventura deportiva en un simulador de baloncesto con física de pelota realista!
Mysterious Adventure of Michael 2,"2,20 €*","• Acción, Aventura, Plataformas",09-05-2024,This is the second in a series of action games featuring the adventures of Michael the bear!
EGGCONSOLE WANDERERS FROM Ys PC-8801mkIISR,"5,59 €*","• Acción, Rol (RPG)",09-05-2024,"The third installment of ""Ys"" with even more action-packed elements! Two years after the Ys adventure. Save Dogi's hometown, Felghana, from the clutches of evil!"
Hentai Girls: Fresh Firefighter,"5,99 €*","• Acción, Otros, Puzle, Uso práctico",09-05-2024,¡Conoce a más de 30 atractivas chicas de anime en este rompecabezas relajante!
Summer Games Challenge,"19,99 €*","• Deportes, Otros, Simulación",09-05-2024,¡A por el oro!
Animals drop,"3,00 €*","• Puzle, Simulación",09-05-2024,Un juego de rompecabezas divertido y desafiante para todas las edades.
Título no disponible,Precio no disponible,Categoría no disponible,Fecha no disponible,Descripción no disponible
,,,Fecha no disponible,
Título no disponible,Precio no disponible,Categoría no disponible,Fecha no disponible,Descripción no disponible
HighScore Anomaly Shop,"3,99 €*","• Puzle, Simulación",09-05-2024,"Este es un juego de anomalías. Cuando comiences estarás en el nivel 0. Se te presentará un área para estudiar la disposición de los objetos, observar tu entorno y familiarizarte con él."
Vampire: Darkness Falls,"4,99 €*","• Comunicación, Otros",09-05-2024,Embrace the shadows or seek the light—survive the night in a world where your choices shape your destiny
Stellarons Superstars: Detectives of the Scarlet Horizons,"4,90 €*","• Aventura, Educativo, Música",09-05-2024,"Conoce esta historia épica de un mundo lleno de misterios, donde los enigmáticos ""Stellarons"" son tus aliados en la lucha contra una malvada hechicera."
Spot the Odd!,"2,49 €*","• Entrenamiento, Fiesta, Uso práctico",09-05-2024,Which One Doesn't Belong? Sharpen Your Reflexes with This Spot-the-Difference Brain Game!
Pummel Party,"14,79 €*","• Acción, Fiesta, Tablero",09-05-2024,Paliza Party es un juego de fiesta multijugador en línea y local para 4-8 jugadores.
Battle Minesweeper Online,"3,99 €*","• Acción, Educativo, Puzle, Tablero",09-05-2024,Minesweeper is now available as a real-time online battle game!
"Little Kitty, Big City","24,99 €16,24 €*","• Aventura, Simulación",09-05-2024,¡Una pacífica siesta gatuna se convierte en una gran aventura!
The Prisoner of the Night,"14,99 €*","• Aventura, Plataformas",08-05-2024,"¡Guía a una niña a través de un mundo oscuro, surreal y pesadillesco en este clásico juego de plataformas!"
The Night of the Rabbit,"19,99 €*","• Aventura, Estrategia, Puzle",08-05-2024,Sumérgete en una historia de magia y fantasía
Animal Puzzle for Kids and Toddlers,"7,99 €*","• Educativo, Otros, Puzle",08-05-2024,"Puzzles Divertidos para Manos Pequeñas - Aprende, Juega y Crece"
King Of Pyramid Thieves,"3,99 €*","• Acción, Aventura, Plataformas, Puzle",08-05-2024,"En el fascinante juego de aventuras King of Pyramid Thieves, te pones en la piel de un hábil ladrón que busca fortuna."
Puzzlerio,"1,99 €*","• Arcade, Estrategia, Puzle, Simulación",07-05-2024,"Puzzlerio is a puzzle game about creating a factory that takes ores from one point to another. Use transport belts, inserters, furnaces and tunnels to complete the factory."
Zombie Survival: The Walking Pandemic,"4,99 €*","• Acción, Aventura, Estilo de vida, Otros",06-05-2024,"En un mundo devastado por una pandemia zombie, un grupo de extraños se une para sobrevivir y descubre que los verdaderos monstruos pueden no ser solo los zombies."
Adventure Field™ Remake,"4,99 €*","• Acción, Arcade, Aventura, Rol (RPG)",06-05-2024,"Embark on a legendary journey to save the kingdom of Sarook from darkness in Adventure Field™ Remake, now enhanced for Nintendo Switch™."
Ninja Shuriken Master,"5,99 €*","• Acción, Arcade, Entrenamiento, Lucha",05-05-2024,Become the Master of Deadly Shurikens!
Simply Snakes,"0,99 €*","• Acción, Arcade, Estrategia, Lucha",04-05-2024,Grow as big as possible!
DungeonSmash - Medieval Dungeons,"5,99 €0,99 €*","• Acción, Arcade, Fiesta, Puzle",04-05-2024,"Break bricks, conquer dungeons. Endless fun awaits!"
Corgi´s Travel,"9,99 €*",• Aventura,04-05-2024,Never let your dog activate a shrinking machine
Justin Wack and the Big Time Hack,"19,99 €*",• Aventura,04-05-2024,"Una entrañable aventura Point & Click en 2D con múltiples personajes jugables y muchas tonterías. Ah, y también hay viajes en el tiempo y relaciones. Y robots, muchos robots..."
"All Noobs must die - Craft, Survival, Mine","12,99 €0,99 €*","• Acción, Disparos (Shooter), Fiesta, Plataformas",03-05-2024,Will you be able to protect the obsidian portal from zombies and survive at any cost?
Exit Slum 11,"2,50 €*","• Acción, Aventura, Puzle",03-05-2024,Exit Slum 11 es un simulador de ejecución de observación de anomalías con una atmósfera inquietante.
Outbreak The Fedora Files What Lydia Knows,"19,99 €6,99 €*","• Aventura, Estrategia, Puzle, Rol (RPG)",03-05-2024,Something isn't right in the city of Cypress Ridge... Experience this one-two punch of an atmospheric visual novel and JRPG taking place before and after the undead apocalypse.
Cyber Citizen Shockman 3: The princess from another world,"5,99 €*","• Aventura, Plataformas",03-05-2024,¡Sonya y Arnold se enfrentan a un misterioso enemigo nuevo en Shockman 3!
Blood Lines : Magicians' Chase2,"10,99 €*","• Acción, Arcade, Disparos (Shooter)",03-05-2024,"Enter the enchanted Mysterious Castle inhabited by zombies, maids, and vampire! Witness legacy unfold in 2D PIXEL ACTION ADVENTURE!"
Título no disponible,Precio no disponible,Categoría no disponible,Fecha no disponible,Descripción no disponible
,,,Fecha no disponible,
Título no disponible,Precio no disponible,Categoría no disponible,Fecha no disponible,Descripción no disponible
Yacht Haven Tycoon: Marina Port Parking Simulator,"11,99 €*","• Acción, Aventura, Estrategia, Simulación",03-05-2024,"Anchor Your Dreams, Build Your Empire. Navigate the Waves of Success in Yacht Haven Tycoon: Marina Port Parking Simulator!"
Bomb Cat,"6,99 €1,99 €*","• Arcade, Puzle",03-05-2024,Empareja gatos ultra peludos para conseguir la máxima puntuación y desata el caos con Bomb Cat.
Pirates Golden Quest,"4,99 €*","• Arcade, Plataformas",03-05-2024,Are you ready to become the ultimate pirate legend?
My Horse Stories,"7,99 €0,99 €*","• Aventura, Deportes, Estilo de vida, Simulación",03-05-2024,Get ready to make unforgettable memories and experience the beauty of the countryside like never before!
Baking Time,"4,99 €0,99 €*","• Aventura, Otros, Simulación",03-05-2024,Get ready for the ultimate bakery game that will satisfy your cooking fever and love for pastries!
Amelia's Diner,"4,99 €*","• Arcade, Puzle, Simulación, Tablero",03-05-2024,"¡Ayuda a Amelia a administrar su restaurante, servir comida deliciosa y hacer felices a sus clientes!"
Tractor Farming Simulator 3D,"6,99 €*","• Arcade, Simulación",03-05-2024,"Are you ready to till the soil, sow the seeds, and reap the rewards?"
Knight Sim Life,"9,99 €*","• Acción, Estrategia",03-05-2024,"""Knight Sim Life"" offers a compelling blend of city-building, farming simulation, and strategic combat."
TriggerHeart EXELICA,"28,99 €*","• Arcade, Disparos (Shooter)",02-05-2024,"""Donde dicten el valor y la convicción, ¡aprieta el gatillo de tu corazón!""."
MotoGP™24,"49,99 €*","• Carreras, Deportes, Simulación",02-05-2024,Solo sucede en MotoGP™24.
Freddi Fish 2: The Case of The Haunted Schoolhouse,"14,99 €*","• Aventura, Educativo",02-05-2024,"So who is haunting the schoolhouse, taking the toys and practically scaring the scales off all the guppies?"
Plantabi: Little Garden,"6,89 €*",• Simulación,02-05-2024,¡Plantabi es un relajante juego sandbox donde cuidas de adorables plantas y diseñas el acogedor jardín de tus sueños!
Freddi Fish Collection,"49,99 €*","• Aventura, Educativo",02-05-2024,5 of the most popular Freddi Fish games in one epic collection!
Touhou Mystia's Izakaya,"25,99 €*","• Música, Simulación",02-05-2024,"An Izakaya simulation game set in Gensokyo, where the Touhou character Mystia Lorelei aims to revive her izakaya business!"
SOWON : The Toy Wonderland,"8,99 €*","• Aventura, Otros, Plataformas, Puzle",02-05-2024,"Una noche, la puerta del ático que nunca se abría, se abrió y envió a una niña a un mundo raro. ¿Podrá regresar a casa algún día?"
Surmount,"14,99 €*","• Aventura, Deportes, Plataformas",02-05-2024,¡Lánzate a una aventura de montaña!
Full Metal Sergeant,"9,99 €*",• Estrategia,02-05-2024,¡Sé el Instructor! Insulta a los reclutas sin remordimientos. ¿Serás capaz de transformar reclutas flácidos en esbeltas máquinas de guerra en 12 semanas?
