Título,Precio,Categoría,Fecha de lanzamiento,Descripción
Myth or Reality: Fairy Lands Collector's Edition,"9,99 €5,99 €*","• Aventura, Puzle",11-07-2024,¡Esta es tu oportunidad de asumir el papel de un investigador famoso con una habilidad especial para descubrir la verdad detrás de mitos y leyendas!
Muv-Luv Alternative Remastered,"39,99 €*",• Aventura,11-07-2024,Se acabó el recreo. Es hora de la desesperación. Experimenta una obra maestra en la emocionante conclusión de la saga Muv-Luv.
Título no disponible,Precio no disponible,Categoría no disponible,Fecha no disponible,Descripción no disponible
,,,Fecha no disponible,
Título no disponible,Precio no disponible,Categoría no disponible,Fecha no disponible,Descripción no disponible
Muv-Luv / Muv-Luv Alternative Remastered Double Pack,"64,99 €*",• Aventura,11-07-2024,¡La edición definitiva de la saga Muv-Luv ya está disponible en Nintendo Switch™! ¡Ambos juegos en un solo paquete!
Prune & Milo,"10,49 €*","• Aventura, Estrategia, Puzle",11-07-2024,Prune & Milo es un juego de rompecabezas por turnos.
Moonshine Inc.,"19,99 €*","• Estilo de vida, Estrategia, Otros, Simulación",11-07-2024,"Porque nada es ilegal..., ¡hasta que te pillan!"
Destroy the world bundle,"24,99 €*","• Aventura, Otros, Rol (RPG), Simulación",11-07-2024,Farm for your Life: Tu comunidad fue azotada una terrible tormenta que causó un apocalipsis y liberó a los muertos vivientes.
Headup Multiplayer Bundle,"24,99 €*","• Acción, Fiesta",11-07-2024,"El Multiplayer Bundle incluye Super Treasure Arena, Doodle Derby y Tied Together."
Sugoi Girls: Kinky Knight,"8,99 €2,99 €*","• Acción, Otros, Puzle, Uso práctico",11-07-2024,¡Conoce a más de 50 atractivas chicas de anime en este rompecabezas relajante!
Urban Warfare: Assault,"16,99 €*","• Acción, Acción en primera persona (FPS), Arcade, Disparos (Shooter)",11-07-2024,"Embark on a heart-pounding journey of combat and strategy in Urban, a third-person solo shooter that pits you against the world's most dangerous terrorists."
ACE COMBAT™7: SKIES UNKNOWN DELUXE EDITION,"59,99 €*","• Acción, Arcade, Disparos (Shooter)",11-07-2024,"¡ACE COMBAT 7: SKIES UNKNOWN, el juego más vendido de la serie ACE COMBAT con más de 5 millones de copias en todo el mundo, por fin está disponible en Nintendo Switch™!"
Hamster Playground,"0,00 €*","• Carreras, Fiesta, Simulación",11-07-2024,¡Todos a bordo del tren del hámster!
HoneyLand,"4,99 €*","• Aventura, Puzle, Tablero",11-07-2024,¡Tu objetivo final es llegar al gran volcán de miel!
Brawl Arena: Arcade Shooter,"4,99 €*","• Acción, Arcade, Disparos (Shooter)",11-07-2024,"¡Un emocionante juego de disparos de arriba hacia abajo con personajes únicos, enemigos poderosos, jefes increíbles y un enorme arsenal de armas!"
Sunlight Scream,"6,99 €*","• Aventura, Otros",11-07-2024,"Max Hardy regresa a Sunlight City, la ciudad de su infancia para su propio hermano. Una nueva universidad, nuevos conocidos, amigos, amor..."
Gluck,"6,89 €*",• Aventura,11-07-2024,"Dig your way through the earth all while avoiding injury, surviving one day at a time. Stay safe..."
EGGCONSOLE POPFUL MAIL PC-8801mkIISR,"5,59 €*","• Acción, Rol (RPG)",11-07-2024,"Set in a world of swords and magic, the comical adventures of a bounty hunter begin. The definitive slapstick action RPG adventure is here!"
Muv-Luv Remastered,"29,99 €*",• Aventura,11-07-2024,¡Una de las series de novelas visuales más aclamadas de la historia ya está disponible en Nintendo Switch™!
Let's Aim Shooting Gallery,"5,00 €*","• Arcade, Comunicación, Fiesta, Puzle",11-07-2024,¡Prepárate para un clásico juego de carnaval: la galería de tiro! ¡Acierta tantos objetivos como puedas y conviértete en el maestro de la galería de tiro!
Busway Islands - Puzzle,"4,99 €*","• Educativo, Puzle, Tablero",11-07-2024,"¡Construye eficientes rutas de autobús a través de hermosas islas! Resuelve puzzles, conecta estaciones y recoge a todos los pasajeros."
Toon Roads : Superbike,"4,99 €*","• Acción, Aventura, Carreras, Deportes",11-07-2024,"Choose your superbike, twist the throttle and LET'S GO, let the race begin!!!"
Primal Survivors,"4,99 €*","• Acción, Disparos (Shooter), Otros",11-07-2024,¡Prepárate para las aventuras más salvajes y emocionantes!
Disaster Band,"9,99 €*","• Fiesta, Música",11-07-2024,¡Que empiece la fiesta!
City Legends: Trapped In Mirror Collector's Edition,"9,99 €*","• Aventura, Puzle",11-07-2024,"En tu camino hacia la escritura de la novela sobrenatural perfecta, prepárate para afrontar el peligro. ¿Estás preparado para medidas tan desesperadas?"
Arcade Archives TINKLE PIT,"6,99 €*","• Acción, Arcade",11-07-2024,A full cast of classic NAMCO characters!
Retro Battle,"1,99 €*",• Arcade,10-07-2024,"Test your skill on retro games with Retro Battle ! NPC Battles • Defy a variety of NPCs, each with unique abilities and strategies, to unlock new challenges and rewards."
True Colours - A Date With Deception,"13,99 €*",• Aventura,10-07-2024,¡Asume el papel del villano o busca la redención definitiva en una novela visual llena de aventura y romance!
Título no disponible,Precio no disponible,Categoría no disponible,Fecha no disponible,Descripción no disponible
,,,Fecha no disponible,
Título no disponible,Precio no disponible,Categoría no disponible,Fecha no disponible,Descripción no disponible
"Verdoria's Kingdom Quest: Magic, Battles & Sorcery","4,90 €*","• Acción, Aventura, Educativo, Música",10-07-2024,Descubre esta emocionante novela visual donde valientes héroes desentrañan antiguos misterios y hechizos. ¡Un viaje épico que no querrás perderte!
Naheulbeuk's Dungeon Master,"29,99 €*","• Estrategia, Simulación",09-07-2024,¡Una mazmorra en peligro!
Let's Journey,"9,99 €*","• Acción, Aventura, Lucha, Rol (RPG)",08-07-2024,"¡Elige a tu héroe, lanza los dados y embárcate en una aventura épica!"
Kubits Gallery,"9,99 €*",• Puzle,08-07-2024,Solve nonogram grids to repaint the vanished paintings inside museums around the world in more than 120 levels in various fictional galleries!
Whispering Paws,"4,99 €*","• Arcade, Aventura, Otros, Plataformas",08-07-2024,"Immerse yourself in a lush and enchanting world, where every step brings you closer to discovering the secrets that will lead to the reunion of the Whispering Paws."
Editor's Hell - Newspaper Story,"9,99 €*","• Arcade, Estrategia, Rol (RPG), Tablero",07-07-2024,"The Power of the Press is in Your Hands, In a World of Lies, Print the Truth."
Game Collection 1,"14,99 €*","• Acción, Aventura, Plataformas, Puzle",06-07-2024,Bundle
Jetpack Race,"0,99 €*","• Acción, Arcade, Carreras, Plataformas",06-07-2024,Take shortcuts to win
The Legend of Heroes: Trails through Daybreak,"59,99 €*","• Acción, Aventura, Rol (RPG)",05-07-2024,Entre la ley y el caos se encuentra el amanecer de la aventura.
Bouncy Chicken,"4,99 €*","• Acción, Puzle",05-07-2024,¡Dispara a tu amigo emplumado y recoge esas mazorcas de maíz!
Highway Zombie Survival - Car Apocalypse,"9,99 €*","• Acción, Carreras, Rol (RPG), Simulación",05-07-2024,"The Road to Survival is Paved with Zombies, accept the challenge, to reach the end!"
Cyber Citizen Shockman Zero,"6,99 €*","• Aventura, Plataformas",05-07-2024,"Experimenta el renacer de un clásico de acción cooperativa retro, pero siempre actual"
AAA Clock Gold,"99,00 €*","• Estilo de vida, Uso práctico",05-07-2024,Siempre contigo y ahora en versión elegante - AAA Clock Gold
Neckbreak,"23,99 €*","• Acción, Acción en primera persona (FPS), Disparos (Shooter), Lucha",05-07-2024,Ábrete camino luchando en este sucio FPS táctico de estilo retro.
Summer Games Beach Volley,"7,99 €*",• Deportes,05-07-2024,Juego de vóley playa con Torneo de los Juegos de Verano
Sir Happenlance,"14,00 €*","• Acción, Fiesta, Lucha, Plataformas",04-07-2024,"Climb huge mountains, impale hundreds of enemies, and solve tricky physics puzzles... all using only a spear. Pole-vault yourself to victory in this epic joust-'em-up adventure!"
MACHI KORO con todos,"24,50 €*","• Estrategia, Fiesta, Tablero",04-07-2024,¡Tira el dado y construye una ciudad a tu gusto!
Uphill Stunt Driver: Extreme Racing Simulator,"4,99 €*","• Arcade, Carreras, Deportes, Simulación",04-07-2024,Carreras extremas en peligrosas pistas montañosas en coches potentes: ¡supera esta difícil subida y conviértete en el rey de la montaña!
Mini Golf League: Sports Simulator,"4,99 €*","• Deportes, Entrenamiento, Puzle, Simulación",04-07-2024,¡Ponte a prueba en un emocionante simulador de minigolf y llévate la copa de campeón en Golf Championship!
Air Hockey: Casual Table Arcade,"4,99 €*","• Acción, Arcade, Deportes, Tablero",04-07-2024,¡Un clásico juego de mesa arcade de deportes en el que puedes desafiar a tus amigos y poner a prueba tus habilidades contra la IA!
Art of Glide 2,"4,19 €*","• Acción, Arcade, Aventura, Puzle",04-07-2024,"Embark on a cozy, endless adventure across the mesmerizing desert landscape in Art of Glide 2. Glide gracefully through the sands, uncovering hidden landmarks as you go."
Clock Creator: My Pendulum Clock,"1,20 €*","• Estilo de vida, Otros, Uso práctico",04-07-2024,Create Your Own Pendulum Clock. Enjoy Relaxing Time with a Swinging Pendulum!
City Legends: The Curse of the Crimson Shadow Collector's Edition,"9,99 €*","• Aventura, Puzle",04-07-2024,"No te asustan las historias de fantasmas, por lo que tu búsqueda de inspiración te lleva a los lugares más extraños. ¿Podrás sobrevivir al encuentro con un espíritu real?"
Silverwood Bay An Eleanor Grey Mystery Collector's Edition,"9,99 €5,99 €*","• Aventura, Puzle",04-07-2024,City Writer se muda a un pequeño pueblo para escribir una historia.
Título no disponible,Precio no disponible,Categoría no disponible,Fecha no disponible,Descripción no disponible
,,,Fecha no disponible,
Título no disponible,Precio no disponible,Categoría no disponible,Fecha no disponible,Descripción no disponible
Darkarta: A Broken Heart Quest Collector's Edition,"9,99 €5,99 €*","• Aventura, Puzle",04-07-2024,Misterio embrujado y lucha de una madre por su pequeña hija.
Mystery Detective Adventure,"13,99 €*","• Aventura, Puzle",04-07-2024,Los sucesos místicos persiguen a los lugareños.
Scoop it! Goldfish,"5,00 €*","• Acción, Arcade, Comunicación, Fiesta",04-07-2024,¡Es hora de un clásico de los juegos de carnaval: pescar peces dorados! ¡Pesca tantos como puedas y conviértete en un maestro!
Choose and Easy NUMBER IQ QUIZ,"7,99 €*","• Entrenamiento, Puzle, Uso práctico",04-07-2024,Complete Brain Training within the Time Limit! Quick and Fun Brain Activity IQ Quiz
Brain Training!! Number Search,"2,49 €*","• Entrenamiento, Fiesta, Uso práctico",04-07-2024,Find the indicated number among many numbers! This is a number-finding brain training game that exercises your quick thinking skills!
Replik Survivors,"4,99 €*","• Acción, Arcade, Disparos (Shooter)",04-07-2024,Replik Survivors is a time survival game with role-playing and roguelite elements. Become a replik(clone girl) to defeat the Lab's enemies.
River Tails: Stronger Together,"19,50 €*","• Acción, Aventura, Plataformas, Puzle",04-07-2024,River Tails: Stronger Together es un juego de plataformas 3D asimétrico y cooperativo.
Puzzle World Bundle,"7,99 €*","• Estrategia, Fiesta, Puzle, Simulación",04-07-2024,¡Gira los elementos del rompecabezas y recopila todas las increíbles imágenes!
Arcade Archives NINJA EMAKI,"6,99 €*","• Arcade, Disparos (Shooter)",04-07-2024,An expansive ninja tale featuring 8 kinds of Ninja Magic and mysterious characters!
Spirits Chronicles: Flower of Hope Collector's Edition,"9,99 €5,99 €*","• Aventura, Puzle",04-07-2024,Evita que un misterioso villano cumpla su aterradora ambición tanto tiempo acariciada.
Viking Heroes V Collector's Edition,"9,99 €5,99 €*","• Estrategia, Simulación",04-07-2024,¡Embárcate en un viaje festivo mientras los vikingos se preparan para Yule!
Hentai Girls: Amazing America,"8,99 €*","• Acción, Otros, Puzle, Uso práctico",04-07-2024,¡Conoce a más de 50 atractivas chicas de anime en este rompecabezas relajante!
Taboo Trial,"18,59 €*","• Acción, Aventura, Estrategia, Rol (RPG)",04-07-2024,"Juego de acción 3D tipo Rogue-like. Eres una valquiria, eliges bendiciones de los dioses nórdicos y vas a completar la Prueba Tabú guiada por Loki."
The Five Covens,"12,99 €*","• Aventura, Plataformas, Puzle",04-07-2024,Bienvenido a un mundo mágico lleno de brujería.
Hot Blood,"9,99 €*","• Acción, Aventura, Lucha",02-07-2024,¡Elimina zombies con una protagonista tan atractiva como mortal en un juego 3D de pocos polígonos!
Food Truck Simulator,"19,99 €*",• Simulación,02-07-2024,"Tu padre era dueño de un camión de comida. Aunque el vehículo ha envejecido, se ha convertido en una piedra angular del legado de su familia. Ahora, en un abrir y cerrar de ojos, tu padre se ha ido. Ahora, el camión de comida te pertenece."
The Battle Cats Unite!,"18,99 €*","• Acción, Estrategia, Simulación",02-07-2024,"At long last, play The Battle Cats with friends! Team up with friends to take on the Doge Army! Show your friends the power of your Cat Army in versus!"
Pups & Purrs Animal Hospital and Pups & Purrs Pet Shop Bundle,"44,99 €*",• Simulación,01-07-2024,¡No hay quien se resista a estas monadas!
Void's Ballad,Precio no disponible,"• Aventura, Puzle",2024,Void’s Ballad is a dark investigative adventure through the biggest human fear: Death.
Aqua Puzzle Adventures,"4,99 €*","• Educativo, Otros, Puzle, Tablero",29-06-2024,¡Resuelve rompecabezas a través del océano!
Switch Race,"0,99 €*","• Acción, Arcade, Carreras, Plataformas",29-06-2024,"Switch your vehicle, match your environment!"
Escapar de la Torre,"4,99 €*","• Acción, Aventura, Plataformas",29-06-2024,"Guía a tu valiente princesa mientras escapa de una formidable torre. Lucha contra hordas de poderosos enemigos, supera obstáculos desafiantes y enfréntate al temible dragón."
Fantasy Saga Frenzy,"4,99 €*","• Acción, Arcade, Fiesta, Puzle",29-06-2024,"¡Sumérgete en un reino mágico con Fantasy Mania Frenzy! En este encantador juego de rompecabezas, te encontrarás fusionando artefactos mágicos para crear combinaciones poderosas. ¡Viaja a través de paisajes fantásticos llenos de magia y descifralos!"
10 in 1 Classic Games Pack,"39,99 €3,99 €*","• Acción, Arcade, Fiesta, Puzle",29-06-2024,"¡Colección de increíbles juegos familiares! ¡Sumérgete en él, juega solo o junto con otros jugadores!"
Título no disponible,Precio no disponible,Categoría no disponible,Fecha no disponible,Descripción no disponible
,,,Fecha no disponible,
Título no disponible,Precio no disponible,Categoría no disponible,Fecha no disponible,Descripción no disponible
Isolated,"9,99 €*",• Otros,29-06-2024,Experience the solitude of being the loneliest person on Earth!
Climbing Over It with a Spear Only Up,"6,99 €0,99 €*","• Acción, Arcade, Plataformas, Rol (RPG)",29-06-2024,"Scale the mountain, overcome obstacles, and climb to victory!"
Gigantosaurus: Dino Sports,"39,99 €*","• Acción, Deportes, Fiesta",28-06-2024,"Prepárate para una fiesta deportiva para hasta cuatro dinosaurios. Estos ocho juegos del tamaño de un mordisco estás repletos de diversión, ¡pero cuidado con Giganto!"
Last Night of Winter,"9,99 €*","• Acción, Aventura, Rol (RPG)",28-06-2024,"¡Levántate y anda, Vigilante, pues el asedio continua! Debemos encontrar a la Heredera y poner fin a esta noche maldita."
Air Sea Modern Conflict,"9,99 €*",• Estrategia,28-06-2024,Juego de estrategia de combate naval y aéreo
At Your Feet,"15,99 €*",• Aventura,28-06-2024,Conquista a mujeres preciosas de pies despampanantes
Nocturnal Visitors,"4,99 €*","• Aventura, Puzle",28-06-2024,Descubre un mundo en el que conviven el caos y el orden.
34 Sports Games - World Edition,"29,99 €*","• Deportes, Fiesta",28-06-2024,"¡""34 Sports Games - World Edition"" es el juego definitivo que reúne 34 deportes diferentes en un solo juego! Desafía a tu familia o amigos y ¡que gane el mejor!"
SPY×ANYA: Operation Memories,"49,99 €*",• Aventura,28-06-2024,La vida cotidiana de una familia improvisada.
Cthulhu tower,"12,99 €*","• Acción, Arcade, Estrategia, Rol (RPG)",28-06-2024,"In Cthulhu Tower, you will plunge into the depths of cosmic horror as you defend the eldritch abominations led by the ancient entity against the relentless onslaught of humanity."
Dead Station 2,"4,99 €*","• Aventura, Plataformas",28-06-2024,This space is not dead... It's alive and hunts you!
Ecchi Secrets,"7,69 €*","• Estilo de vida, Fiesta, Otros, Puzle",28-06-2024,Encuentra todos los secretos ocultos de las tentadoras chicas anime
Offroad Masters: Motocross Races,"3,99 €0,99 €*","• Arcade, Carreras",28-06-2024,Embark on an adrenaline-fueled adventure with Offroad Masters: Motocross Races!
HALVA Studio 2023 Bundle,"14,99 €*","• Acción, Aventura, Puzle, Simulación",28-06-2024,"Explora 2023 con HALVA Studio. Relájate en una simulación original, atraca un banco lleno de tesoros, defiende el mundo de los zombis o embárcate en una aventura misteriosa. ¡Tú eliges!"
Kingdom's Dungeon Rage,"5,99 €*","• Aventura, Plataformas, Puzle",28-06-2024,El rey ha sido tomado como rehén y encerrado en una mazmorra.
There's No Dinosaurs 2,"6,99 €3,49 €*","• Otros, Puzle",28-06-2024,We are back with “There’s No Dinosaurs 2” - a relaxing hidden object point & click game in which your objective is to locate randomly placed dinosaurs.
Hollow Police Emblem: The Visual Novel,"9,90 €*","• Aventura, Música, Otros, Puzle",28-06-2024,Una novela visual donde un detective debe resolver intrigantes casos criminales mientras navega por las complejidades de sus relaciones personales.
Grandma Cleaning Simulator - Family Business Tycoon,"11,99 €*","• Acción, Aventura, Estrategia, Simulación",28-06-2024,"Clean, Build, Prosper: Sweep Your Way to Success and Family Fortune!"
Hentai Solitaire,"11,99 €0,99 €*","• Arcade, Estrategia, Puzle, Simulación",28-06-2024,¡Saca un as de tu bolsillo y comprueba qué retos te esperan!
Sky Survivors,"4,99 €*","• Acción, Arcade, Disparos (Shooter), Plataformas",28-06-2024,Construye una poderosa estructura para sobrevivir a las hordas de monstruos.
Yori's Journey: Forgotten Origins,"9,99 €0,99 €*","• Acción, Estrategia, Lucha, Rol (RPG)",28-06-2024,"Unleash your skills and face your foes, go to the end and survive the experiment."
Magnus Trilogy,"8,99 €*","• Aventura, Otros, Puzle",27-06-2024,Explore the depths of the human psyche.
Tchia,"29,99 €*","• Acción, Aventura",27-06-2024,Un juego inspirado en Nueva Caledonia.
Fortress Challenge - Fort Boyard,"39,99 €*",• Fiesta,27-06-2024,¡Vuelve a Fort Boyard y enfréntate a los nuevos desafíos de Sir Fouras!
Título no disponible,Precio no disponible,Categoría no disponible,Fecha no disponible,Descripción no disponible
,,,Fecha no disponible,
Título no disponible,Precio no disponible,Categoría no disponible,Fecha no disponible,Descripción no disponible
Battle Crush,"0,00 €*","• Acción, Lucha",27-06-2024,"¡El debut de un juego de acción y lucha brutal! Los controles son sencillos, pero ¡el combate se las trae! Acaba con los oponentes gracias a habilidades espectaculares"
Cape's Escape Game 9th Room,"9,80 €3,03 €*","• Aventura, Puzle",27-06-2024,Escape game with cute but quirky characters
A Street Cat's Tale 2: Outside is Dangerous,"13,49 €*","• Aventura, Estrategia, Rol (RPG), Simulación",27-06-2024,A Street Cat's Tale 2: Outside is Dangerous es un juego de aventuras que combina historias conmovedoras con la acción que rodea al gato casero Cinnamon.
Room Renovator: Furniture Decor Simulator,"4,99 €2,99 €*","• Estilo de vida, Estrategia, Puzle, Simulación",27-06-2024,¡Conviértete en un verdadero diseñador de interiores y muestra tu creatividad en la cocina en el nuevo simulador de decoración de habitaciones!
Boat Driver: Ship Parking Simulator,"4,99 €*","• Arcade, Carreras, Entrenamiento, Simulación",27-06-2024,"¡Un simulador de estacionamiento de barcos emocionante y realista! Aparcar barcos no es una tarea fácil, ¡es una auténtica prueba de precisión!"
Flying Tank,"14,99 €*","• Acción, Arcade, Aventura, Disparos (Shooter)",27-06-2024,¡Haz pedazos a los álienes!
Mega Ramp Car Jumping,"8,99 €3,59 €*","• Acción, Carreras, Deportes, Simulación",27-06-2024,Ski-jumping - in a car - over city skylines and through clouds? What could go wrong?
Whacking Hell!,"9,99 €*","• Acción, Arcade, Disparos (Shooter)",27-06-2024,"""Whacking Hell!"" es un juego de disparos frenético en 2D con elementos de roguelite. Las puertas del infierno se han abierto: ¡golpea a todos los monstruos antes de que ellos te golpeen a ti!"
ECHOLOCAUTION,"4,99 €*","• Acción, Arcade, Disparos (Shooter), Música",27-06-2024,Can Sound See as Well as Eyes? Use the ability of echolocation to see in the dark and join the bats on a night hunt!
MERGE BLOCK PUZZLE,"2,99 €*","• Estrategia, Puzle, Tablero",27-06-2024,"Move the blocks with the same number to fuse them together. As time goes by, the blocks will be added to the game, so"
Make it! Yakitori,"3,00 €*","• Arcade, Comunicación, Fiesta, Puzle",27-06-2024,"¡Es hora de cocinar un clásico de la comida callejera: yakitori! Ásalos con salsa, ásalos con sal y prepara todo tipo de estilos populares de yakitori."
Shogun,"4,99 €*","• Estrategia, Otros",27-06-2024,"Carve your legacy in a world of samurais, where strategy, prosperity, and heritage converge."
EGGCONSOLE TOPPLE ZIP PC-8801,"5,59 €*","• Acción, Carreras, Disparos (Shooter)",27-06-2024,"Ride the Zippin and join the race on Frolic Planet. To overcome the grueling races, you can't afford to hold back."
TSUKIHIME -A piece of blue glass moon-,"54,99 €*","• Aventura, Otros",27-06-2024,Ah... Qué hermosa está la luna esta noche... Así comienza la célebre historia de TSUKIHIME.
Luxor Evolved,"22,99 €*","• Acción, Arcade, Disparos (Shooter), Estrategia",27-06-2024,"¡El tremendamente popular juego de disparos de canicas estilo neón, finalmente en Nintendo Switch™!"
Radiant Tale -Fanfare!-,"49,99 €*",• Aventura,27-06-2024,"Un insólito grupo de artistas formado por un dragón loco, un payaso siniestro, un mago inseguro, un acróbata incapaz de entretener y un director de pista reacio hace un esfuerzo desesperado por reformar un circo en ruinas."
NeoSprint,"24,99 €*","• Arcade, Carreras, Deportes, Simulación",27-06-2024,"¡La emocionante serie de carreras clásicas de Atari ""Sprint"" regresa con NeoSprint!"
planetarian: Snow Globe,"4,99 €*","• Aventura, Otros",27-06-2024,"Prequel to visual novel studio Key's touching sci-fi tale, ""planetarian: The Reverie of a Little Planet"", ""planetarian: Snow Globe"" now on Nintendo Switch™!"
Arcade Archives JACKAL,"6,99 €*","• Acción, Arcade",27-06-2024,They bring hell.
Hole Theory,"2,00 €*","• Arcade, Estilo de vida, Plataformas, Simulación",27-06-2024,Cometelo todo
The Alpha Wolf,"7,99 €1,59 €*","• Acción, Aventura, Rol (RPG), Simulación",27-06-2024,"""The Alpha Wolf"" es un simulador RPG donde construyes y lideras una manada de lobos. Personaliza y mejora a tus lobos, caza para sobrevivir, desbloquea habilidades mágicas."
Cheating Reset - 浮気リセット -,"15,90 €*","• Aventura, Simulación",27-06-2024,A happy life of living together. I thought it was going well all this time. Let's start over. Let's go back to six months ago...
DIFFICULT CLIMBING GAME,"9,99 €0,99 €*","• Acción, Plataformas, Puzle, Simulación",27-06-2024,"""Difficult Climbing Game offers a more streamlined and easier climbing experience compared to other climbing games, yet it remains captivating. Use ""shifts"" to grab and the ""up"" to lift yourself to the top."
Gun Rounds,"9,89 €*","• Acción, Arcade, Estrategia, Rol (RPG)",27-06-2024,En esta aventura rogue-like de 1-bit ¡tú disparas primero! ¡Pero luego una oleada de enemigos te disparará a ti! ¡Prepárate para bloquearlos en el momento adecuado!
Título no disponible,Precio no disponible,Categoría no disponible,Fecha no disponible,Descripción no disponible
,,,Fecha no disponible,
Título no disponible,Precio no disponible,Categoría no disponible,Fecha no disponible,Descripción no disponible
Lady & Lonely Boy ～お嬢様とぼっちくん～,"23,40 €*","• Aventura, Simulación",27-06-2024,Enrolling in an all-girls school as the only boy!?A harem academy life where I'm at the mercy of a young lady with almost no knowledge of men is about to begin...!
planetarian: The Reverie of a Little Planet & Snow Globe,"14,99 €*","• Aventura, Otros",27-06-2024,"Visual novel studio Key's sci-fi tale ""planetarian: The Reverie of a Little Planet"" and its prequel ""planetarian: Snow Globe"" now available as a single package!"
How to Sing to Open Your Heart Remastered,"14,99 €*","• Aventura, Rol (RPG), Simulación",27-06-2024,Can the cat-eared princess' song rescue her people and find true love?
FROGUE,"4,99 €*","• Acción, Arcade, Plataformas, Puzle",27-06-2024,"Embárcate en un viaje generado proceduralmente en FROGUE, un juego de plataformas roguelike bullet hell."
Go Go Jump!!!,"9,99 €*","• Acción, Arcade, Aventura",26-06-2024,¡Esquiva peligros para alcanzar la victoria en un simple y divertido juego de acción que todos pueden jugar!
